id,nome,categoria,periodo,publico,custo,avaliacao,endereco,horario,imagem,resumo,card_img,descricao,dicas
1,Praia de Tambaú,Praia,manha|tarde|noite,casal|familia|amigos|sozinho,baixo,4.8,"Av. Almirante Tamandaré, Tambaú, João Pessoa – PB","",praia_tambau.jpg,"O coração litorâneo da capital. Reconhecida pelo mar calmo, orla movimentada e feirinha de artesanato.",foto-orla.webp,"A Praia de Tambaú é um dos destinos turísticos mais conhecidos de João Pessoa e se destaca por sua orla movimentada, infraestrutura urbana e grande variedade de atividades para moradores e visitantes. Localizada em uma das regiões mais centrais da cidade, a praia reúne lazer, comércio, gastronomia e belas paisagens do litoral paraibano. O bairro de Tambaú desenvolveu-se como uma importante área turística da capital, concentrando hotéis, restaurantes, feiras de artesanato e espaços de convivência. Sua orla urbanizada possui calçadão, ciclovia e áreas utilizadas para caminhadas, esportes e eventos culturais, especialmente durante a noite. A região ainda se destaca pela proximidade com outras áreas importantes da cidade, como Cabo Branco e Manaíra.","Vá cedo para evitar o sol forte|Experimente a tapioca na orla|Ótima para famílias com crianças"
2,Centro cultural e Igreja de São Francisco,Histórico,manha|tarde,casal|familia|amigos|sozinho,baixo,4.7,"Praça São Francisco, Centro, João Pessoa – PB","Ter–Dom: 8h–12h e 14h–17h",igreja_sao_francisco.jpg,"Importante conjunto histórico e religioso do século XVII, com igreja dourada, claustros com azulejos portugueses e museu de arte sacra",centro-sfrancisco-externo.jpg,"O Centro Cultural São Francisco é um dos mais importantes conjuntos históricos e religiosos de João Pessoa, destacando-se pela riqueza artística, pela arquitetura barroca e por sua relevância para a história cultural da Paraíba. Localizado no centro histórico da cidade, o complexo reúne igreja, convento, capelas e amplos espaços decorados com elementos artísticos coloniais. A construção do conjunto teve início no período colonial, sendo ligada à presença franciscana na região. O complexo impressiona pela grande quantidade de detalhes ornamentais presentes em suas paredes, altares e corredores. Elementos em pedra calcária, azulejos portugueses, pinturas sacras e entalhes em madeira compõem os ambientes internos, revelando características marcantes da arte religiosa colonial. Entre os espaços mais conhecidos estão a Igreja de São Francisco, o adro decorado com cruzeiro, os claustros do convento e os painéis de azulejos históricos que retratam passagens religiosas e aspectos da vida franciscana.","Vista roupas adequadas|Há guias turísticos no local|Verifique se há Missa com canto gregoriano (canto uníssono em latim)"
3,Parque Solon de Lucena,Natural,manha|tarde,familia|amigos|sozinho,baixo,4.5,"Lagoa, Centro, João Pessoa – PB","",parque_solon.jpg,"Tradicional área de lazer no centro de João Pessoa, conhecida pela lagoa central, áreas verdes e importância histórica para a cidade.",parque-lagoa.webp,"O Parque Sólon de Lucena, popularmente conhecido como Lagoa, é um dos espaços públicos mais conhecidos de João Pessoa. Localizado na região central da cidade, o parque tornou-se um importante ponto de convivência, lazer e circulação urbana da capital paraibana. O espaço é marcado pela grande lagoa central cercada por áreas arborizadas, pistas para caminhada e locais destinados ao descanso e à convivência. Ao longo dos anos, o parque passou por revitalizações que ampliaram as áreas de lazer e modernizaram parte de sua estrutura. Além da importância paisagística, o Parque Sólon de Lucena possui relevância histórica para a cidade, funcionando como um dos principais pontos de referência do centro de João Pessoa. O parque também recebe eventos culturais, apresentações e atividades públicas em diferentes períodos do ano, tornando-se espaço de encontro para moradores e visitantes.","Ideal para caminhadas matinais|Ciclovia disponível|Leve repelente ao entardecer"
4,Praia de Cabo Branco,Praia,manha|tarde,casal|familia|amigos|sozinho,baixo,4.7,"Av. Cabo Branco, Cabo Branco, João Pessoa – PB","",praia_cabo_branco.jpg,"Conhecida por suas belas paisagens e pelo famoso Farol do Cabo Branco, é um dos cartões-postais mais visitados de João Pessoa.",praia-cabo-branco.jpg,"A Praia de Cabo Branco é uma das áreas mais famosas de João Pessoa, localizada no litoral leste da cidade, próxima à de Tambaú. O local combina natureza, áreas urbanizadas e importantes pontos turísticos. A região ganhou destaque por abrigar o Farol do Cabo Branco, situado a cerca de 800m do ponto mais oriental das Américas. Além disso, a praia possui uma longa faixa de areia, ciclovia e espaços destinados à prática esportiva. O bairro também concentra restaurantes, hotéis e áreas culturais, tornando-se uma das regiões mais movimentadas da capital paraibana. Entre as atividades mais comuns estão caminhadas na orla, passeios de bicicleta, visitas ao farol e apreciação do nascer do sol.","Excelente para caminhadas ao amanhecer|Visite o Farol do Cabo Branco|A ciclovia da orla é ideal para passeios de bicicleta"
5,Piscinas de Picãozinho,Natural,manha|tarde,casal|familia,medio,4.7,"Praia de Tambaú, Tambaú, João Pessoa – PB","Conforme a maré",piscinas_picaozinho.jpg,"Formadas durante a maré baixa, elas encantam visitantes com águas claras, recifes e passeios de catamarã saindo da Praia de Tambaú.",piscinas-picaozinho.webp,"As Piscinas Naturais de Picãozinho são uma das atrações marítimas mais conhecidas de João Pessoa. Localizadas a poucos quilômetros da costa da Praia de Tambaú, formam-se sobre recifes de corais durante os períodos de maré baixa, criando piscinas de águas claras e relativamente calmas. O passeio até Picãozinho costuma ser realizado em catamarãs que partem da orla de Tambaú. As piscinas naturais tornam-se mais visíveis quando a maré está baixa, revelando áreas rasas onde é possível nadar, observar peixes e aproveitar o ambiente marinho. Por isso, os horários dos passeios variam de acordo com a tábua de marés, fator importante para quem deseja visitar o local. Além do banho de mar, uma das atividades mais procuradas é o mergulho recreativo com máscara e snorkel, permitindo maior contato com a vida marinha da região.","Consulte a tábua de marés antes de ir|Leve máscara de mergulho|Observe os peixes entre os recifes"
6,Praia do Bessa,Praia,manha|tarde,casal|familia|amigos|sozinho,baixo,4.3,"Av. Governador Argemiro de Figueiredo, Bessa, João Pessoa – PB","",praia_bessa.webp,"Praia mais tranquila, ideal para quem quer ambientes para passeios sossegados em família.",praia-do-bessa.jpg,"A Praia do Bessa é uma das praias urbanas mais tranquilas de João Pessoa, conhecida pelo ambiente mais calmo e pela extensa faixa de areia. Localizada na região norte da orla da capital, a praia atrai moradores e visitantes em busca de lazer, caminhadas e banho de mar. O local possui águas mornas e áreas com mar relativamente tranquilo em determinados períodos, favorecendo atividades ao ar livre e esportes na areia. A orla conta com bares, quiosques e espaços bastante utilizados para passeios e prática esportiva. A Praia do Bessa também é conhecida por suas áreas menos movimentadas em comparação com outras praias urbanas da cidade, mantendo um ambiente mais residencial e familiar. Em alguns trechos, durante a maré baixa, formam-se piscinas naturais próximas à costa.","Ideal para quem busca menos movimento|Ótima para caminhadas|Procure as piscinas naturais na maré baixa"
7,Mercado de Artesanato Paraibano,Cultural,manha|tarde,casal|familia|amigos|sozinho,baixo,4.6,"Av. Rui Carneiro, Tambaú, João Pessoa – PB","Seg.–Sáb. 9h–19h; Dom. 9h–18h",mercado_artesanato.webp,"Espaço tradicional de João Pessoa que reúne artesanato regional, produtos culturais e itens típicos da cultura paraibana.",map.jpg,"O Mercado de Artesanato Paraibano é um dos principais espaços dedicados à cultura e ao artesanato regional em João Pessoa. Localizado na região de Tambaú, o mercado reúne lojas e estandes com produtos típicos da cultura paraibana e nordestina. O espaço é bastante procurado por turistas interessados em lembranças, peças decorativas e artigos produzidos por artesãos locais. Entre os produtos encontrados estão rendas, bordados, esculturas, objetos em madeira, peças em barro, redes, roupas e itens ligados à tradição cultural da região. Além do artesanato, o mercado também possui áreas voltadas à gastronomia regional, com produtos típicos e comidas tradicionais nordestinas. O ambiente reúne elementos da cultura popular paraibana e funciona como importante ponto de valorização da produção artesanal local.","Ótimo para comprar lembranças típicas|Conheça os produtos gastronômicos regionais|Leve dinheiro para pequenas compras"
8,Estação Cabo Branco,Cultural,manha|tarde,familia|amigos|sozinho,baixo,4.3,"Av. João Cirilo da Silva, Altiplano Cabo Branco, João Pessoa – PB","Seg.–Sex. 9h–18h; Sáb. e Dom. 10h–18h",estacao_cabo_branco.webp,"Centro cultural assinado por Niemeyer com exposições, mirante e um dos mais marcantes prédios contemporâneos da Paraíba.",estacao-cabo-branco.jpg,"A Estação Cabo Branco - Ciência, Cultura e Artes - é um dos principais centros culturais de João Pessoa. Localizada no bairro do Altiplano Cabo Branco, tornou-se um importante ponto turístico e cultural da capital paraibana. O complexo foi projetado pelo renomado arquiteto Oscar Niemeyer, conhecido por obras marcantes da arquitetura moderna brasileira. A construção apresenta formas curvas e estrutura contemporânea, características presentes em diversos projetos do arquiteto pelo país. A Estação Cabo Branco possui áreas destinadas a exposições de arte, auditórios, salas de eventos, espaços para oficinas culturais e ambientes voltados à observação da paisagem litorânea. O local frequentemente recebe apresentações musicais, mostras artísticas, palestras e atividades educativas abertas ao público. Além das atrações culturais, a região oferece vista privilegiada do litoral de João Pessoa, atraindo visitantes interessados tanto na programação artística quanto na arquitetura e no ambiente ao redor.","Vale a visita pela arquitetura|Aproveite o mirante|As áreas externas rendem ótimas fotografias"
9,Hotel Globo,Histórico,tarde|noite,casal|familia|sozinho,baixo,4.5,"Praça São Frei Pedro Gonçalves, Centro, João Pessoa – PB","Ter.–Dom. (conforme programação)",hotel_globo.jpg,"Histórico edifício do centro de João Pessoa, conhecido pela arquitetura preservada e pela vista do pôr do sol sobre o rio Sanhauá.",hotel-globo.jpg,"O Hotel Globo é um dos edifícios históricos mais conhecidos do centro histórico de João Pessoa. Construído no início do século XX, o local tornou-se um importante patrimônio cultural da cidade e destaca-se pela arquitetura histórica e pela vista privilegiada para o rio Sanhauá. Originalmente utilizado como hospedagem, o prédio recebeu visitantes e personalidades durante diferentes períodos da história da capital paraibana. Com o passar dos anos, o edifício passou por processos de preservação e restauração, sendo transformado em espaço cultural e turístico. O Hotel Globo é bastante conhecido pelo terraço com vista panorâmica para o pôr do sol sobre o rio Sanhauá, considerado um dos cenários mais marcantes do centro histórico da cidade. O espaço abriga exposições artísticas, apresentações culturais e atividades ligadas à preservação da memória histórica de João Pessoa.","Chegue perto do pôr do sol|Visite as exposições culturais|Fotografe a vista para o rio Sanhauá"
10,Mosteiro de São Bento,Histórico,manha|tarde,casal|familia|sozinho,baixo,4.9,"Praça Dom Ulrico, Centro, João Pessoa – PB","Conforme atividades religiosas",mosteiro_sao_bento.jpg,"Tradicional monumento religioso do centro histórico, conhecido pela arquitetura colonial e pela importância cultural e espiritual em João Pessoa.",mosteiro-de-sao-bento.webp,"O Mosteiro de São Bento é um dos mais importantes monumentos históricos e religiosos de João Pessoa. Localizado no centro histórico da capital paraibana, o conjunto destaca-se pela arquitetura colonial, pela tradição beneditina e por sua relevância para a formação histórica da cidade. A construção do mosteiro teve início durante o período colonial e, ao longo dos séculos, o local tornou-se referência religiosa e cultural na região. O interior da igreja possui altares ornamentados, imagens religiosas e detalhes artísticos característicos das construções coloniais. A fachada e os ambientes internos refletem a influência da arquitetura religiosa desenvolvida no Brasil durante os séculos XVII e XVIII. Além de sua importância histórica e religiosa, o Mosteiro de São Bento também é conhecido pela atmosfera silenciosa e contemplativa, preservando características tradicionais da vida monástica beneditina.","Vista-se respeitosamente|Observe os detalhes da arte sacra|Mantenha o silêncio durante a visita"
11,Teatro Santa Roza,Cultural,noite,casal|amigos|sozinho,medio,4.7,"Praça Pedro Américo, Centro, João Pessoa – PB","Conforme eventos",teatro-santa-roza.jpg,"Mais antigo teatro da Paraíba, conhecido pela arquitetura neoclássica e pelas apresentações artísticas no centro de João Pessoa.",teatro-santa-roza-externo.jpeg,"O Teatro Santa Roza é um dos mais antigos e importantes espaços culturais de João Pessoa. Localizado no centro histórico da capital, o teatro possui grande relevância para a história artística e cultural da Paraíba. Inaugurado no século XIX, o edifício tornou-se palco de apresentações teatrais, concertos, eventos culturais e manifestações artísticas que marcaram diferentes períodos da história da cidade. Sua arquitetura apresenta características neoclássicas, preservando elementos históricos que remetem às antigas casas de espetáculo brasileiras. O interior do teatro destaca-se pela decoração tradicional, pelos camarotes e pelo ambiente histórico, mantendo características que refletem a importância cultural do espaço ao longo dos anos. O local continua sendo utilizado para apresentações artísticas, festivais e atividades culturais promovidas na capital paraibana.","Confira a programação antes da visita|Observe a arquitetura interna|Visite também o entorno histórico"
12,Ponta do Seixas,Natural,manha|tarde,familia|amigos|sozinho,baixo,4.5,"Av. Ponta do Seixas, Seixas, João Pessoa – PB","",ponta_do_seixas.jpg,"O ponto mais oriental das Américas. Aqui o sol nasce primeiro no continente. Falésias, mar azul intenso e o Farol do Cabo Branco compõem o cenário.",ponta-do-seixas.jpg,"A Ponta do Seixas é um dos pontos turísticos mais conhecidos de João Pessoa por abrigar o ponto mais oriental das Américas, local onde o sol nasce primeiro no continente americano. Situada no litoral da capital paraibana, a região destaca-se pelas paisagens naturais, pelas falésias e pela vista ampla do Oceano Atlântico. O local tornou-se símbolo turístico da cidade e recebe visitantes interessados tanto em sua importância geográfica quanto em sua beleza natural. A área possui mirantes e espaços de observação que permitem contemplar o encontro entre as falésias, a vegetação costeira e o mar. As falésias presentes na área foram moldadas pela ação natural do vento e do mar ao longo dos anos, formando paisagens características do litoral paraibano. A Praia do Seixas, localizada nas proximidades, complementa o cenário com águas mornas e faixa de areia extensa.","Melhor horário: nascer do sol|Leve água e proteção solar|Visite também o Farol do Cabo Branco"
13,Praia do Jacaré,Natural,tarde,casal|familia|amigos|sozinho,baixo,4.8,"Rua Jacaré, Jacaré, Cabedelo – PB","",praia_do_jacare.jpg,"O pôr do sol mais famoso do Nordeste. Diariamente, ao som do Bolero de Ravel tocado em saxofone sobre as águas do Rio Paraíba, o sol se despede da cidade.",por-do-sol-jacare.jpg,"A Praia do Jacaré é um dos locais turísticos mais tradicionais da região metropolitana de João Pessoa, situada às margens do rio Paraíba, no município de Cabedelo. O local tornou-se conhecido nacionalmente pelo famoso pôr do sol acompanhado pelo som do Bolero de Ravel, tradição que atrai visitantes diariamente. Diferentemente das praias voltadas para o oceano, a Praia do Jacaré possui ambiente fluvial, com águas calmas e extensa área de contemplação às margens do rio. A região conta com bares, restaurantes, feiras de artesanato e espaços destinados ao turismo e ao lazer. O principal momento de visitação ocorre no final da tarde, quando turistas e moradores se reúnem para assistir ao pôr do sol. Durante esse período, músicos realizam apresentações sobre embarcações no rio, mantendo viva a tradição cultural que tornou o local um dos cartões-postais mais famosos da Paraíba.","Chegue antes do pôr do sol|Faça um passeio de catamarã|Aproveite a feira de artesanato"
14,Parque Arruda Câmara (Bica),Natural,manha|tarde,familia|amigos|sozinho,baixo,4.4,"Av. Gouveia Nóbrega, Tambiá, João Pessoa – PB","Ter.–Dom. 8h–17h",bica.jpg,"Um dos principais espaços de lazer e contato com a natureza em João Pessoa, reunindo áreas verdes, trilhas e diversas espécies de animais em um ambiente ideal para toda a família.",bica-zoo.jpg,"O Parque Zoobotânico Arruda Câmara, conhecido popularmente como Bica, é uma das principais áreas verdes de João Pessoa. Localizado no bairro de Tambiá, o espaço reúne zoológico, jardim botânico e áreas de preservação ambiental, funcionando como importante centro de educação ambiental e lazer. Criado em uma área de mata nativa, o parque abriga diversas espécies de animais, entre aves, répteis e mamíferos, além de uma rica variedade de plantas características da Mata Atlântica. O nome Bica surgiu devido às fontes naturais de água existentes no local, que historicamente abasteciam parte da cidade. Entre os principais atrativos estão as trilhas ecológicas, os recintos dos animais, os espaços para observação da natureza e as áreas destinadas a atividades educativas. O parque desenvolve ações voltadas para conservação ambiental, pesquisa científica e conscientização dos visitantes sobre a importância da preservação da fauna e da flora.","Ideal para famílias e crianças|Use calçados confortáveis|Aproveite as trilhas ecológicas"
15,Areia Vermelha,Natural,manha|tarde,casal|familia|amigos|sozinho,medio,4.7,"Praia de Camboinha, Camboinha, Cabedelo – PB","Conforme a maré",areia_vermelha.png,"Belo banco de areia que surge durante a maré baixa, formando um cenário paradisíaco de águas cristalinas e proporcionando uma experiência única no litoral paraibano.",areia-vermelha.webp,"Areia Vermelha é um dos destinos naturais mais conhecidos do litoral paraibano. Localizada no município de Cabedelo, a formação surge durante os períodos de maré baixa, revelando um banco de areia avermelhada cercado por águas claras e recifes. O local tornou-se uma das atrações mais procuradas da região por oferecer um cenário singular em meio ao mar. O acesso costuma ser realizado por embarcações que partem de praias próximas, especialmente de Camboinha, permitindo aos visitantes apreciar a paisagem costeira durante o trajeto. Durante a maré baixa, forma-se uma extensa área de areia onde visitantes podem caminhar, tomar banho de mar e aproveitar as águas rasas ao redor dos recifes. A transparência da água favorece a observação da vida marinha e torna o local bastante procurado para fotografias e lazer.","Vá em maré baixa|Use proteção solar|Evite ficar até a subida da maré"
16,Priscylla's Hall,Vida Noturna,noite,amigos,medio,4.5,"Av. Monte Castelo, 73, Mandacaru, João Pessoa – PB","Sex.–Sáb. a partir das 22h",priscyllas_hall_card.jpg,"Uma das boates mais populares de João Pessoa, com música eletrônica, funk e sertanejo universitário em um ambiente animado.",priscyllas_hall_card.jpg,"A Priscilla's Hall é uma casa de eventos localizada no bairro de Manaíra, em João Pessoa, destacando-se pela realização de shows, festas e apresentações culturais. O espaço integra a vida noturna da capital paraibana e recebe eventos de diferentes estilos musicais. O local possui estrutura voltada para grandes públicos, contando com área para apresentações, espaços de convivência e serviços de apoio aos visitantes. Ao longo dos anos, a casa tornou-se um dos pontos de encontro para entretenimento na cidade, recebendo artistas locais e nacionais em sua programação. Entre as atividades mais comuns estão a participação em shows, eventos temáticos, festas e apresentações culturais.","Compre o ingresso antecipado nos fins de semana|Chegue depois da meia-noite para o pico da festa|Confira a programação nas redes sociais"
17,Skybar,Vida Noturna,noite,casal|amigos,alto,4.7,"Rua Maria das Dores Souza, 81, Altiplano, João Pessoa – PB","Conforme eventos",skybar.jpg,"O night club mais alto da América Latina, no topo de um edifício no Altiplano, com vista deslumbrante para João Pessoa e ambiente sofisticado.",skybar_card.jpg,"O SkyBar é um espaço de lazer e gastronomia localizado em João Pessoa, conhecido por oferecer vista panorâmica da cidade e ambiente voltado ao entretenimento noturno. O estabelecimento reúne restaurante, bar e áreas de convivência, proporcionando aos visitantes uma experiência que combina gastronomia e contemplação da paisagem urbana. O local tornou-se uma opção frequente para encontros sociais, comemorações e momentos de lazer, atraindo tanto moradores quanto turistas. Entre as atividades mais comuns estão apreciar o pôr do sol, participar de eventos, desfrutar da gastronomia local e observar a vista da cidade.","Confira os eventos especiais antes de ir|Vista-se bem — o ambiente é sofisticado|A vista ao entardecer é um espetáculo à parte"
18,Giramundo,Vida Noturna,noite,casal|amigos|sozinho,medio,4.4,"Av. Almirante Tamandaré, 564, Tambaú, João Pessoa – PB","Seg.–Sáb. a partir das 18h",giramundo_card.jpg,"Bar animado na orla de Tambaú com grande variedade de drinks, petiscos regionais e ambiente descontraído para happy hour e noitadas.",giramundo_card.jpg,"O Giramundo é um espaço cultural e de entretenimento situado no Centro Histórico de João Pessoa, destacando-se pela realização de apresentações musicais, eventos artísticos e atividades culturais. Instalado em uma área de relevância histórica da capital, o local contribui para a valorização do patrimônio cultural e para a dinamização da vida noturna da região central. O espaço recebe apresentações de artistas locais e promove eventos que incentivam a produção cultural paraibana. Entre as atividades mais comuns estão assistir a shows, participar de eventos culturais e conhecer o patrimônio histórico do entorno.","Ótimo para começar a noite antes de ir a outros lugares|Experimente os petiscos regionais|Frequentado por turistas e moradores"
19,General Store,Vida Noturna,noite,amigos|sozinho,baixo|medio,4.4,"Rua Duque de Caxias, 54, Centro Histórico, João Pessoa – PB","Ter.–Sáb. a partir das 18h",general_store_card.jpg,"Bar e espaço cultural no Centro Histórico, point dos descolados de João Pessoa, com shows variados e ambiente alternativo.",general_store_card.jpg,"A General Store é um estabelecimento localizado em João Pessoa que reúne gastronomia, entretenimento e atividades culturais, sendo reconhecido como um ponto de encontro para moradores e visitantes. O espaço oferece ambiente voltado à convivência, recebendo apresentações musicais, eventos temáticos e programações voltadas ao lazer. Sua proposta combina serviços de alimentação e entretenimento, contribuindo para a diversidade da vida noturna da cidade. Entre as atividades mais comuns estão participar de eventos, assistir a apresentações musicais e desfrutar da gastronomia oferecida pelo local.","Confira a programação de shows antes de ir|Boa pedida para quem gosta de música ao vivo|Explore o entorno histórico antes de entrar"
20,Vila do Porto,Vida Noturna,noite,amigos|sozinho,baixo|medio,4.3,"Praça São Frei Pedro Gonçalves, 8, Varadouro, João Pessoa – PB","Conforme programação",vila_do_porto.jpg,"Casa de shows e festas no Centro Histórico, em frente ao Hotel Globo, com programação cultural variada e apelo à cena indie e alternativa.",vila_do_porto_card.jpg,"A Vila do Porto é um espaço cultural localizado no Centro Histórico de João Pessoa, destacando-se pela promoção de atividades artísticas, musicais e culturais. Instalada em uma área de grande importância histórica, a Vila do Porto abriga eventos que valorizam a produção cultural local e incentivam a ocupação dos espaços históricos da cidade. O local recebe apresentações de diferentes estilos musicais, exposições e manifestações artísticas, consolidando-se como referência cultural na capital paraibana. Entre as atividades mais comuns estão assistir a shows, participar de eventos culturais, visitar exposições e conhecer o Centro Histórico de João Pessoa.","Combine com um passeio pelo Centro Histórico antes do show|Fique de olho na programação — os eventos variam muito|O ambiente externo no Varadouro é muito agradável"
